Unnamed: 0,rating,industry,content,masked_subcat,masked_keyword,catering|environment,catering|price,catering|cusine,catering|service,hotel|environment,hotel|price,hotel|service,attraction|environment,attraction|price,attraction|transportation,banking_finance_insurance|product,banking_finance_insurance|service,banking_finance_insurance|price,industry_granular,explaination,sentiment_score,sentiment_label,path_keywords_dict,path_counts,path_list,true_label_array,false_label_array,Got Correct,Accuracy,is_marked,Unnamed: 28,Unnamed: 29
124906,4,hotel,it helped to see that prior to my booking this hotel was marked here in tripadvisor as one of the top hotels with a very good rating indeed staff are friendly and accommodating there s a shuttle bus service that picks up to and from the airport before after taking the airport express to from tsim sha tsui and to from the hotel if you re not in a hurry and not interested in tourist y places then this hotel is very good for you the hotel food is mid priced and has a variety of fusion selections but nearby is tsui wah resto where the price is cheaper and is usually packed with the locals authentic hk flavor you d want to taste too across this resto a must try also is king bakery where they have tasty packed dumplings and great bread selections just a 3 min walk ,"['price', 'environment', 'service']","['booking', 'tripadviso', 'tour', 'iced', 'rice', 'eat', 'bake', 'min', 'nearby', 'price', 'rest', 'cheap', 'rested', 'tripadv', 'ice', 'tripadvisor', 'food', 'bread', 'hotel w', 'shuttle', 'hotel f', 'hotel', 'places', 'rio', 'fla', 'nterested', 'priced', 'interest', 'interested', 'marked', 'trip', 'touris', 'hotels w', 'staf', 'bakery', 'hotel food', 'want', 'hen', 'top hotels', 'place', 'top hotel', 'flavor', 'por', 'tourist', 'hotels']",0,0,0,0,1,1,1,0,0,0,0,0,0,hotel|price,"[""\n\nThe review mentions the hotel's service multiple times, highlighting its top rating, shuttle bus service, and friendly staff. The review also mentions the hotel's food, which is mid-priced and has a variety of fusion selections. Additionally, the review mentions nearby restaurants and bakeries, such as Tsui Wah Resto and King Bakery, which offer authentic Hong Kong flavors and tasty packed dumplings. All of these attributes contribute to the overall positive sentiment expressed in the review. \n\n"", ""\n\nThe review mentions the hotel's price multiple times, noting that it is mid-priced and that nearby restaurants and bakeries offer cheaper prices. This suggests that the hotel is reasonably priced and provides good value for money, which contributes to the overall positive sentiment expressed in the review."", ""\n\nThe review mentions the hotel's environment multiple times, noting that it was marked as one of the top hotels on TripAdvisor. This suggests that the hotel is well-regarded and provides a pleasant and comfortable environment, which contributes to the overall positive sentiment expressed in the review.""]",4,positive,"defaultdict(<class 'list'>, {('hotel', 'service', 'others'): ['tour', 'ice', 'food', 'place', 'hotel', 'shuttle', 'marked', 'hen', 'rest', 'bread'], ('hotel', 'service', 'breakfast'): ['iced', 'flavor', 'hotel food', 'rested', 'rice', 'eat', 'bake', 'staf', 'bakery'], ('hotel', 'service', 'facility'): ['nearby', 'places', 'tourist', 'hotel w', 'hotels w', 'hotels', 'hotel f', 'top hotel', 'booking'], ('hotel', 'price', 'others'): ['interest', 'min', 'price', 'cheap', 'priced', 'interested', 'want'], ('hotel', 'environment', 'resort'): ['por', 'top hotels', 'tripadviso', 'tripadv', 'tripadvisor', 'rio', 'fla', 'trip'], ('hotel', 'service', 'staff'): ['touris'], ('hotel', 'price', 'special offer'): ['nterested']})","Counter({('hotel', 'service', 'others'): 10, ('hotel', 'service', 'breakfast'): 9, ('hotel', 'service', 'facility'): 9, ('hotel', 'environment', 'resort'): 8, ('hotel', 'price', 'others'): 7, ('hotel', 'service', 'staff'): 1, ('hotel', 'price', 'special offer'): 1})","[{'path': ('hotel', 'service'), 'count': 29, 'keywords': ['top hotel', 'tour', 'hen', 'rice', 'booking', 'bread', 'place', 'eat', 'rest', 'tourist', 'flavor', 'hotel w', 'food', 'hotels w', 'marked', 'nearby', 'hotel', 'bakery', 'iced', 'ice', 'rested', 'staf', 'shuttle', 'hotels', 'hotel food', 'hotel f', 'places', 'bake', 'touris']}, {'path': ('hotel', 'price'), 'count': 8, 'keywords': ['cheap', 'priced', 'min', 'interested', 'price', 'interest', 'want', 'nterested']}, {'path': ('hotel', 'environment'), 'count': 8, 'keywords': ['tripadvisor', 'top hotels', 'tripadviso', 'fla', 'rio', 'trip', 'tripadv', 'por']}]","[(""hotel, service""):""1"", (""hotel, price""):""1"", (""hotel, environment""):""1""]",[],,,,3,
99359,4,hotel,great deal and great location very convenient location near the escalator restaurants bars and transportation there was some construction going on across the street but hk is a busy place so i hardly noticed it friendly staff free cellphone with the room espresso machine in room pod type more free coffee in lobby convenience stores everywhere wherever you choose to stay be prepared to walk a lot of hills ,"['price', 'environment', 'service']","['iced', 'great deal', 'eat', 'rest', 'lat', 'location', 'ice', 'restaurant', 'coffee', 'cho', 'choos', 'restaurants', 'fee', 'deal', 'room', 'staf', 'hills', 'restauran', 'choo', 'place', 'por', 'location near']",0,0,0,0,1,1,1,0,0,0,0,0,0,hotel|price,"[""\n\nThe review mentions the hotel's convenient location near the escalator, restaurants, bars, and transportation. The review also mentions the friendly staff and the free cellphone with the room, as well as the espresso machine in the room and the free coffee in the lobby. These attributes contribute to the overall positive sentiment of the review, as they provide a comfortable and convenient experience for the guest. \n\n- Analyzing '('hotel', 'amenities')' (mentioned 8 times): "", '\n\nThe review mentions the construction going on across the street, but the reviewer hardly noticed it due to the busy nature of Hong Kong. Additionally, the reviewer mentions the need to walk a lot of hills, which could be seen as a negative aspect of the environment. However, this is balanced out by the convenience of the location and the amenities provided by the hotel, which contribute to the overall positive sentiment of the review.', '\n\nThe review mentions that the hotel provided a great deal, which could be seen as a positive attribute. This could be seen as a contributing factor to the overall positive sentiment of the review, as it implies that the guest was satisfied with the price they paid for the hotel.']",4,positive,"defaultdict(<class 'list'>, {('hotel', 'service', 'breakfast'): ['choos', 'choo', 'iced', 'room', 'coffee', 'eat', 'cho', 'staf'], ('hotel', 'service', 'others'): ['location', 'ice', 'restaurant', 'restaurants', 'place', 'restauran', 'fee', 'rest'], ('hotel', 'environment', 'resort'): ['hills', 'por'], ('hotel', 'service', 'facility'): ['location near', 'lat'], ('hotel', 'price', 'others'): ['deal', 'great deal']})","Counter({('hotel', 'service', 'breakfast'): 8, ('hotel', 'service', 'others'): 8, ('hotel', 'environment', 'resort'): 2, ('hotel', 'service', 'facility'): 2, ('hotel', 'price', 'others'): 2})","[{'path': ('hotel', 'service'), 'count': 18, 'keywords': ['choos', 'ice', 'location near', 'location', 'lat', 'room', 'restaurants', 'staf', 'restauran', 'choo', 'cho', 'restaurant', 'place', 'eat', 'fee', 'coffee', 'iced', 'rest']}, {'path': ('hotel', 'environment'), 'count': 2, 'keywords': ['por', 'hills']}, {'path': ('hotel', 'price'), 'count': 2, 'keywords': ['great deal', 'deal']}]","[(""hotel, service""):""1"", (""hotel, environment""):""1"", (""hotel, price""):""1""]",[],,,,3,
99522,5,hotel,five star guest service this hotel knows how to treat its guest room were a good size for hk nice harbour view only downside was that there s not much around but easy to get a taxi because they help you get one and if you don t mind walking for 10 min you can get to to shueng wan subway very convienently ,"['price', 'environment', 'service']","['guest room', 'room', 'min', 'hotel', 'hotel knows', 'hotel know', 'guest service', 'ice', 'eat', 'guest', 'subway']",0,0,0,0,1,1,1,0,0,0,0,0,0,hotel|price,"[""\n  Attributes: Quality of service, hospitality, convenience\n\nThe review mentions the quality of service and hospitality provided by the hotel, which is reflected in the keywords 'guest' and 'hotel know'. The review also mentions the convenience of the hotel, as it is easy to get a taxi and there is a nearby subway station. These attributes contribute to the overall positive sentiment expressed in the review. \n\n- Analyzing '('room', 'size')' (mentioned 4 times"", '\n  Attributes: Value for money\n\nThe review mentions the value for money offered by the hotel, as it is only a 10 min walk to the subway station. This attribute contributes to the overall positive sentiment expressed in the review.', ""\n  Attributes: Cleanliness, comfort\n\nThe review mentions the cleanliness and comfort of the hotel, which is reflected in the keyword 'hotel knows'. These attributes contribute to the overall positive sentiment expressed in the review.""]",5,positive,"defaultdict(<class 'list'>, {('hotel', 'service', 'others'): ['ice', 'hotel', 'guest service'], ('hotel', 'service', 'breakfast'): ['room', 'subway', 'eat'], ('hotel', 'price', 'others'): ['min'], ('hotel', 'service', 'facility'): ['guest room', 'hotel know'], ('hotel', 'environment', 'resort'): ['hotel knows'], ('hotel', 'service', 'staff'): ['guest']})","Counter({('hotel', 'service', 'others'): 3, ('hotel', 'service', 'breakfast'): 3, ('hotel', 'service', 'facility'): 2, ('hotel', 'price', 'others'): 1, ('hotel', 'environment', 'resort'): 1, ('hotel', 'service', 'staff'): 1})","[{'path': ('hotel', 'service'), 'count': 9, 'keywords': ['ice', 'guest', 'room', 'hotel know', 'hotel', 'eat', 'subway', 'guest room', 'guest service']}, {'path': ('hotel', 'price'), 'count': 1, 'keywords': ['min']}, {'path': ('hotel', 'environment'), 'count': 1, 'keywords': ['hotel knows']}]","[(""hotel, service""):""1"", (""hotel, price""):""0"", (""hotel, environment""):""1""]",[],,,,2,
124641,5,hotel,nice experience to stay in this hotel again since my previous stay last year it seems the room amenities have been improved especially the toiletries and slippers the hotel room corridor was also lightly lit this time as compared to that in last year the dining credits are also important elements for us to enjoy the stay as my friend wanted to dine in room the hotel staff was efficient to provide rubbish bag for us to pack up the food boxes after the dining thanks ,"['price', 'environment', 'service']","['spec', 'toiletries', 'hotel room', 'wanted', 'dine', 'din', 'dining', 'las', 'toilet', 'ice', 'special', 'food', 'oil', 'hotel', 'hotel staff', 'room', 'staf', 'want', 'amenities', 'por']",0,0,0,0,1,1,1,0,0,0,0,0,0,hotel|price,"[""\n  Attributes: Price, Value for Money\nThe review mentions that the hotel provided a good value for money, which is likely to have contributed to the positive sentiment. The review also mentions that the hotel staff was efficient in providing rubbish bags for the food boxes, which suggests that the hotel was attentive to the needs of its guests. This could have been a factor in the positive sentiment.\n\n- Analyzing '('room', 'amenities')' (mentioned 3 times): \n "", '\n  Attributes: Quality of Service, Cleanliness, Attention to Detail\nThe review mentions that the room amenities have been improved, which suggests that the hotel is attentive to the needs of its guests. The review also mentions that the hotel staff was efficient in providing rubbish bags for the food boxes, which suggests that the hotel was attentive to the needs of its guests. This could have been a factor in the positive sentiment. Additionally, the review mentions that the hotel room corridor was lightly lit this time as', '\n  Attributes: Ambience, Comfort\nThe review mentions that the hotel room corridor was lightly lit this time as compared to that in last year, which suggests that the hotel is attentive to the needs of its guests and provides a comfortable environment. This could have been a factor in the positive sentiment.']",5,positive,"defaultdict(<class 'list'>, {('hotel', 'price', 'special offer'): ['special'], ('hotel', 'service', 'others'): ['ice', 'food', 'oil', 'amenities', 'dining', 'hotel', 'toilet', 'hotel staff'], ('hotel', 'service', 'breakfast'): ['room', 'toiletries', 'dine', 'din', 'staf'], ('hotel', 'service', 'facility'): ['las', 'hotel room'], ('hotel', 'environment', 'resort'): ['por'], ('hotel', 'price', 'others'): ['spec', 'wanted', 'want']})","Counter({('hotel', 'service', 'others'): 8, ('hotel', 'service', 'breakfast'): 5, ('hotel', 'price', 'others'): 3, ('hotel', 'service', 'facility'): 2, ('hotel', 'price', 'special offer'): 1, ('hotel', 'environment', 'resort'): 1})","[{'path': ('hotel', 'price'), 'count': 4, 'keywords': ['wanted', 'special', 'want', 'spec']}, {'path': ('hotel', 'service'), 'count': 15, 'keywords': ['toilet', 'ice', 'din', 'room', 'amenities', 'dining', 'hotel staff', 'toiletries', 'hotel room', 'dine', 'staf', 'oil', 'las', 'food', 'hotel']}, {'path': ('hotel', 'environment'), 'count': 1, 'keywords': ['por']}]","[(""hotel, price""):""1"", (""hotel, service""):""1"", (""hotel, environment""):""1""]",[],,,,3,
126342,5,hotel,located in east kowloon 20 30 min by mrt to the main sights the hotel is new and well equiped there are comfy beds and pillow menu mrt station and shopping mall are located in the same building you can get there by the lift the hotel is clean staff is friendly it can be littel bit bothering if your room is near the lift since local chieniese people are very noisy ,"['price', 'environment', 'service']","['room', 'bed', 'staf', 'low', 'hotel', 'ate', 'pillow', 'mall', 'beds', 'lean', 'din', 'min']",0,0,0,0,1,1,1,0,0,0,0,0,0,hotel|price,"[""\n  Attributes: The hotel is located in East Kowloon, which is 20-30 minutes away from the main sights by MRT. This makes it a great option for those looking for a budget-friendly stay. Additionally, the MRT station and shopping mall are located in the same building, making it easy to access. \n\n- Analyzing '('hotel', 'amenities')' (mentioned 1 time): \n  Keywords: ['new', 'well-"", ""\n  Attributes: The hotel is new and well-equipped, with comfy beds and a pillow menu. The staff is friendly and the hotel is clean. This contributes to a great overall experience. \n\n- Analyzing '('hotel', 'location')' (mentioned 1 time): \n  Keywords: ['mrt', 'lift', 'building']\n  Attributes: The MRT station and shopping mall are located in the same building, making it easy to access.""]",5,positive,"defaultdict(<class 'list'>, {('hotel', 'price', 'others'): ['low', 'min'], ('hotel', 'service', 'breakfast'): ['room', 'staf', 'ate', 'pillow', 'lean', 'din'], ('hotel', 'service', 'others'): ['bed', 'hotel', 'beds'], ('hotel', 'service', 'facility'): ['mall']})","Counter({('hotel', 'service', 'breakfast'): 6, ('hotel', 'service', 'others'): 3, ('hotel', 'price', 'others'): 2, ('hotel', 'service', 'facility'): 1})","[{'path': ('hotel', 'price'), 'count': 2, 'keywords': ['low', 'min']}, {'path': ('hotel', 'service'), 'count': 10, 'keywords': ['din', 'ate', 'lean', 'room', 'beds', 'staf', 'bed', 'hotel', 'mall', 'pillow']}]","[(""hotel, price""):""0"", (""hotel, service""):""1""]","[('hotel, environment': '0')]",,,,1,
128226,4,hotel,stayed here for couple of nights while i was visiting hong kong for the first time the hotel is located on the hong kong island and is in a good location near causeway bay hotel is clean and modern rooms are ok size and cleanliness is ok as well check in experience was good and quick and staff are friendly at the hotel overall i did not had any issues staying at this hotel and i think if you are looking somewhere cheap and nice i would recommend this hotel as there are not many cheap hotels in hong kong ,"['price', 'environment', 'service']","['land', 'ate', 'visiting', 'cheap hotels', 'rooms', 'cheap', 'cheap hotel', 'bay hotel', 'visit', 'location', 'ice', 'islan', 'island', 'hotel overall', 'hotel', 'coup', 'visiti', 'kong island', 'causeway bay hotel', 'room', 'staf', 'nights', 'visitin', 'lean', 'location near', 'night', 'hotels']",0,0,0,0,1,1,1,0,0,0,0,0,0,hotel|price,"[""\n  Attributes: Cleanliness, Location, Service\nThe review mentions the hotel's location near Causeway Bay, which is a popular area in Hong Kong. This suggests that the hotel is conveniently located and provides easy access to the city's attractions. Additionally, the review mentions that the rooms are clean and the staff are friendly, which indicates that the hotel provides good service. Furthermore, the review states that the hotel is clean and modern, suggesting that the hotel is well-maintained and up"", '\n  Attributes: Environment, Price\nThe review mentions that the hotel is located on the Hong Kong Island, which suggests that the hotel is in a good environment. Additionally, the review states that the hotel is one of the few cheap hotels in Hong Kong, indicating that the hotel is reasonably priced. This suggests that the hotel provides a good environment at an affordable price, which contributes to the positive sentiment expressed in the review.', '\n  Attributes: Price\nThe review mentions that the hotel is one of the few cheap hotels in Hong Kong, indicating that the hotel is reasonably priced. This suggests that the hotel provides good value for money, which contributes to the positive sentiment expressed in the review.']",4,positive,"defaultdict(<class 'list'>, {('hotel', 'service', 'others'): ['nights', 'night', 'land', 'location', 'ice', 'visit', 'hotel'], ('hotel', 'service', 'facility'): ['location near', 'visiting', 'rooms', 'bay hotel', 'hotel overall', 'hotels', 'island'], ('hotel', 'service', 'breakfast'): ['room', 'ate', 'staf', 'lean'], ('hotel', 'environment', 'resort'): ['visitin', 'cheap hotels', 'cheap hotel', 'islan', 'visiti', 'kong island', 'causeway bay hotel'], ('hotel', 'price', 'others'): ['cheap'], ('hotel', 'price', 'package'): ['coup']})","Counter({('hotel', 'service', 'others'): 7, ('hotel', 'service', 'facility'): 7, ('hotel', 'environment', 'resort'): 7, ('hotel', 'service', 'breakfast'): 4, ('hotel', 'price', 'others'): 1, ('hotel', 'price', 'package'): 1})","[{'path': ('hotel', 'service'), 'count': 18, 'keywords': ['location near', 'ice', 'visit', 'hotel overall', 'ate', 'room', 'visiting', 'bay hotel', 'lean', 'land', 'staf', 'night', 'nights', 'hotels', 'hotel', 'rooms', 'island', 'location']}, {'path': ('hotel', 'environment'), 'count': 7, 'keywords': ['visitin', 'kong island', 'islan', 'cheap hotel', 'causeway bay hotel', 'cheap hotels', 'visiti']}, {'path': ('hotel', 'price'), 'count': 2, 'keywords': ['cheap', 'coup']}]","[(""hotel, service""):""1"", (""hotel, environment""):""1"", (""hotel, price""):""1""]",[],,,,3,
120958,4,hotel,the location of the hotel was excellent and the view from the window was even more beautiful in the morning as we could see the beach and a view small vessels in the sea the hotel looks like it is newly built and was very neat and clean the beds were very comfortable and we had a very sound sleep the bathroom was a little small but was sufficient with all amenities the shuttle bus service was excellent as well and i even enjoyed swimming steam and sauna at the health club which also had good machines for workout but the hotel must improve its breakfast spread as the variety served was not sufficient for vegetarian people the staff was very helpful and provided immediate first aid when my father got an injury on his nose because of the half opened entrance door over all a ,"['price', 'environment', 'service']","['bed', 'fort', 'ate', 'hotel look', 'breakfast spread', 'morning', 'bathroo', 'beach', 'eat', 'min', 'health', 'open', 'sauna', 'hotel must', 'sea', 'swimming', 'location', 'provided', 'ice', 'hotel looks', 'tea', 'fat', 'workout', 'hotel w', 'shuttle', 'hotel', 'hotel looks like', 'opened', 'vegetarian', 'hotel l', 'room', 'staf', 'bath', 'swim', 'bathroom', 'hen', 'mall', 'club', 'amenities', 'breakfast', 'beds', 'lean', 'sleep']",0,0,0,0,1,1,1,0,0,0,0,0,0,hotel|price,"[""\n\nThe review mentions the hotel's service multiple times, highlighting its excellent shuttle bus service, comfortable beds, neat and clean rooms, and amenities such as a health club with sauna and steam. The review also mentions the hotel's breakfast spread, which could be improved for vegetarian people. The staff is also praised for providing immediate first aid when needed. All these attributes contribute to the overall positive sentiment of the review.\n\n- Analyzing '('location', 'view')' (mentioned 15"", ""\n\nThe review mentions the hotel's environment multiple times, highlighting its beautiful view from the window, with the beach and small vessels in the sea. The review also mentions the hotel's swimming pool, which is a great amenity for guests. All these attributes contribute to the overall positive sentiment of the review."", ""\n\nThe review mentions the hotel's price multiple times, highlighting its reasonable prices and the fact that the staff provided immediate first aid when needed. All these attributes contribute to the overall positive sentiment of the review.""]",4,positive,"defaultdict(<class 'list'>, {('hotel', 'service', 'facility'): ['fort', 'hotel w', 'hotel looks like', 'hotel l', 'mall', 'hotel look', 'hotel looks', 'hotel must'], ('hotel', 'environment', 'others'): ['beach', 'swimming'], ('hotel', 'service', 'others'): ['sea', 'location', 'ice', 'amenities', 'bed', 'health', 'club', 'hotel', 'beds', 'shuttle', 'hen'], ('hotel', 'environment', 'resort'): ['swim', 'bathroo'], ('hotel', 'service', 'breakfast'): ['bathroom', 'room', 'breakfast', 'fat', 'ate', 'breakfast spread', 'morning', 'eat', 'tea', 'workout', 'vegetarian', 'staf', 'lean', 'sleep'], ('hotel', 'price', 'others'): ['min', 'open', 'opened'], ('hotel', 'service', 'cleaniness'): ['bath', 'sauna'], ('hotel', 'price', 'special offer'): ['provided']})","Counter({('hotel', 'service', 'breakfast'): 14, ('hotel', 'service', 'others'): 11, ('hotel', 'service', 'facility'): 8, ('hotel', 'price', 'others'): 3, ('hotel', 'environment', 'others'): 2, ('hotel', 'environment', 'resort'): 2, ('hotel', 'service', 'cleaniness'): 2, ('hotel', 'price', 'special offer'): 1})","[{'path': ('hotel', 'service'), 'count': 35, 'keywords': ['room', 'amenities', 'vegetarian', 'bath', 'club', 'hotel looks', 'hen', 'breakfast', 'sleep', 'eat', 'ate', 'lean', 'hotel w', 'morning', 'tea', 'hotel looks like', 'breakfast spread', 'fort', 'location', 'sea', 'hotel look', 'beds', 'sauna', 'bed', 'workout', 'hotel', 'mall', 'ice', 'hotel must', 'fat', 'staf', 'shuttle', 'bathroom', 'hotel l', 'health']}, {'path': ('hotel', 'environment'), 'count': 4, 'keywords': ['swimming', 'bathroo', 'beach', 'swim']}, {'path': ('hotel', 'price'), 'count': 4, 'keywords': ['opened', 'open', 'provided', 'min']}]","[(""hotel, service""):""1"", (""hotel, environment""):""1"", (""hotel, price""):""0""]",[],,,,2,
