Unnamed: 0,rating,industry,content,masked_subcat,masked_keyword,catering|environment,catering|price,catering|cusine,catering|service,hotel|environment,hotel|price,hotel|service,attraction|environment,attraction|price,attraction|transportation,banking_finance_insurance|product,banking_finance_insurance|service,banking_finance_insurance|price,industry_granular,explaination,sentiment_score,sentiment_label,path_keywords_dict,path_counts,path_list,true_label_array,false_label_array,Got Correct,Accuracy,is_marked,Unnamed: 28,Unnamed: 29
43601,5,banking_finance_insurance,i contacted right to health last year as i had been with my private health provider for around 35 years and during lockdown i decided to review all insurances contracts etc to see if i could reduce my annual costs unfortunately it was too late to cancel my private insurance as i paid my annual premium upfront we agreed that i would be contacted approx a month prior to expiry i was pleasantly surprised to be contacted and more importantly all the medical information i had provided was retained and i was provided with a reasonable alternative quote i found the adviser alle very professional informative and a pleasure to talk to,"['price', 'service']","['pre', 'provider', 'premium', 'private insurance', 'annual premium', 'cost', 'costs', 'insurance', 'contract', 'greed', 'paid', 'pro', 'private', 'prior']",0,0,0,0,0,0,0,0,0,0,0,1,1,banking_finance_insurance|price,"[""\n  Attributes: The customer was pleased with the price of the insurance, as they were able to reduce their annual costs. The customer was also pleased with the fact that they were contacted prior to the expiry of their contract, and were provided with a reasonable alternative quote.\n\n- Analyzing '('banking_finance_insurance', 'service')' (mentioned 8 times): \n  Keywords: ['professional', 'pleasure', 'contact', 'informative"", '\n  Attributes: The customer was pleased with the service they received from Right to Health, as they found the adviser to be professional, informative and a pleasure to talk to. The customer was also pleased with the fact that all of their medical information was retained.']",5,positive,"defaultdict(<class 'list'>, {('banking_finance_insurance', 'price', 'premium'): ['contract', 'insurance', 'provider', 'private insurance', 'annual premium', 'pro', 'private', 'pre', 'prior'], ('banking_finance_insurance', 'price', 'others'): ['costs', 'premium', 'paid', 'cost'], ('banking_finance_insurance', 'service', 'market trend'): ['greed']})","Counter({('banking_finance_insurance', 'price', 'premium'): 9, ('banking_finance_insurance', 'price', 'others'): 4, ('banking_finance_insurance', 'service', 'market trend'): 1})","[{'path': ('banking_finance_insurance', 'price'), 'count': 13, 'keywords': ['paid', 'pre', 'insurance', 'annual premium', 'prior', 'contract', 'private insurance', 'provider', 'pro', 'private', 'costs', 'cost', 'premium']}, {'path': ('banking_finance_insurance', 'service'), 'count': 1, 'keywords': ['greed']}]","[(""banking_finance_insurance, price""):""1"", (""banking_finance_insurance, service""):""1""]","[('banking_finance_insurance, product': '1')]",3,,,,
22004,5,banking_finance_insurance,the immediate and focused attention i received from james murphy cork office and later his colleagues gene and marie i instinctively knew that i was dealing with experienced professionals who had and hopefully always will a refreshingly welcoming and genuine manner i was politely informed of every aspect of my travel itinerary and questions were answered with patience and knowledge sadly so rare these days follow up contact was punctual clear and informative well done to all ,['price'],"['league', 'low', 'per', 'pro', 'full', 'experience', 'genuine']",0,0,0,0,0,0,0,0,0,0,0,0,1,banking_finance_insurance|price,"['\n\nThe review mentions several attributes related to the banking, finance, and insurance services provided by James Murphy Cork Office. The reviewer mentions that they received immediate and focused attention, which suggests that the services provided were of a professional and experienced level. Furthermore, the review mentions that the price of the services was low, indicating that the services were affordable and accessible. This combination of professional and experienced services at a low price likely contributed to the positive sentiment expressed in the review. \n\n\n- Analyzing']",5,positive,"defaultdict(<class 'list'>, {('banking_finance_insurance', 'price', 'others'): ['low', 'per', 'genuine', 'full'], ('banking_finance_insurance', 'price', 'premium'): ['league', 'pro', 'experience']})","Counter({('banking_finance_insurance', 'price', 'others'): 4, ('banking_finance_insurance', 'price', 'premium'): 3})","[{'path': ('banking_finance_insurance', 'price'), 'count': 7, 'keywords': ['genuine', 'low', 'pro', 'league', 'experience', 'full', 'per']}]","[(""banking_finance_insurance, price""):""0""]","[('banking_finance_insurance, service': '0'), ('banking_finance_insurance, product': '1')]",1,,,,
22867,5,banking_finance_insurance,good cover at a reasonable price,['price'],['price'],0,0,0,0,0,0,0,0,0,0,0,0,1,banking_finance_insurance|price,"[""\n  Attributes: The review mentions that the cover is at a reasonable price, which implies that the customer is satisfied with the cost of the product. This contributes to the overall positive sentiment expressed in the review.\n\n- Analyzing '('banking_finance_insurance', 'quality')' (mentioned 1 times): \n  Keywords: ['good']\n  Attributes: The review mentions that the cover is of good quality, which implies that the customer is satisfied with the""]",5,positive,"defaultdict(<class 'list'>, {('banking_finance_insurance', 'price', 'others'): ['price']})","Counter({('banking_finance_insurance', 'price', 'others'): 1})","[{'path': ('banking_finance_insurance', 'price'), 'count': 1, 'keywords': ['price']}]","[(""banking_finance_insurance, price""):""1""]","[('banking_finance_insurance, service': '1'), ('banking_finance_insurance, product': '1')]",3,,,,
28217,5,banking_finance_insurance,really helpful woth everything and really cheap for a single mum and the lady troy was really nice and explained everything,['price'],['cheap'],0,0,0,0,0,0,0,0,0,0,0,0,1,banking_finance_insurance|price,"[""\n  Attributes: The review mentions that the price was 'cheap', which likely contributed to the positive sentiment expressed in the review. This is especially beneficial for single mothers, who may have limited financial resources. \n\n- Analyzing '('banking_finance_insurance', 'service')' (mentioned 1 times): \n  Keywords: ['helpful', 'nice']\n  Attributes: The review mentions that the service was 'helpful' and the lady was""]",5,positive,"defaultdict(<class 'list'>, {('banking_finance_insurance', 'price', 'others'): ['cheap']})","Counter({('banking_finance_insurance', 'price', 'others'): 1})","[{'path': ('banking_finance_insurance', 'price'), 'count': 1, 'keywords': ['cheap']}]","[(""banking_finance_insurance, price""):""0""]","[('banking_finance_insurance, service': '0'), ('banking_finance_insurance, product': '1')]",1,,,,
133394,4,hotel,as you know hong kong is limit space but not for metropark mongkok that i got big room and also clean easy access to mtr by foot walk both price edward and mongkok how ever hotel is too old i will come back to this hotel again if posible,"['price', 'environment', 'service']","['price', 'room', 'hotel', 'war', 'ever hotel', 'rice', 'ice', 'spa', 'park', 'lean']",0,0,0,0,1,1,1,0,0,0,0,0,0,hotel|price,"[""\n  Attributes: Cleanliness, convenience, comfort, amenities, and customer service.\n\nThe review mentions the hotel's cleanliness, convenience, comfort, and amenities, which are all attributes that contribute to a positive sentiment. The review also mentions the hotel's customer service, which is an important factor in creating a positive experience. Additionally, the review mentions the hotel's proximity to the MTR, which is a convenient feature that adds to the overall positive sentiment. \n\n- Analyzing"", ""\n  Attributes: Value for money.\n\nThe review mentions the hotel's price, which is an important factor in determining the overall sentiment. The review suggests that the hotel offers good value for money, which is a positive attribute that contributes to the overall sentiment."", ""\n  Attributes: Age, atmosphere, and ambience.\n\nThe review mentions the hotel's age, which is an important factor in determining the overall sentiment. The review suggests that the hotel is old, which could be seen as a negative attribute. However, the review also mentions that the hotel is easy to access, which could be seen as a positive attribute. Additionally, the review does not mention anything about the atmosphere or ambience of the hotel, which could be seen as a neutral attribute""]",4,positive,"defaultdict(<class 'list'>, {('hotel', 'service', 'others'): ['ice', 'spa', 'hotel', 'war'], ('hotel', 'service', 'facility'): ['park'], ('hotel', 'service', 'breakfast'): ['room', 'rice', 'lean'], ('hotel', 'price', 'others'): ['price'], ('hotel', 'environment', 'resort'): ['ever hotel']})","Counter({('hotel', 'service', 'others'): 4, ('hotel', 'service', 'breakfast'): 3, ('hotel', 'service', 'facility'): 1, ('hotel', 'price', 'others'): 1, ('hotel', 'environment', 'resort'): 1})","[{'path': ('hotel', 'service'), 'count': 8, 'keywords': ['ice', 'room', 'lean', 'park', 'spa', 'hotel', 'rice', 'war']}, {'path': ('hotel', 'price'), 'count': 1, 'keywords': ['price']}, {'path': ('hotel', 'environment'), 'count': 1, 'keywords': ['ever hotel']}]","[(""hotel, service""):""1"", (""hotel, price""):""0"", (""hotel, environment""):""1""]",[],,,,2,0.756666667
113205,5,hotel, front office team rick carmen annie gigi tina andy executive club lounge art jamming party staffs bellboy staffs club lounge friendly helpful thank you so much for creating a wonderful stay experience for us ,"['price', 'environment', 'service']","['tea', 'staf', 'eating', 'club lounge friendly', 'wonderful stay experience', 'party', 'lounge', 'club lounge', 'eatin', 'club', 'ice', 'eat', 'min']",0,0,0,0,1,1,1,0,0,0,0,0,0,hotel|price,"['\n  Attributes: Quality of service, friendliness of staff, cleanliness of the hotel, availability of amenities, variety of food options.\n\nThe review mentions the quality of service provided by the hotel staff, specifically the front office team, bellboy staffs, and executive club lounge party staffs. The review also mentions the friendliness of the staff, as well as the cleanliness of the hotel. Furthermore, the review mentions the availability of amenities such as the club lounge and the variety', ""\n  Attributes: Value for money, affordability.\n\nThe review mentions the value for money offered by the hotel, as evidenced by the mention of the 'min' price. This suggests that the hotel offers a good price for the services and amenities provided.\n\nOverall, the review expresses a positive sentiment towards the hotel, with the review mentioning the quality of service, friendliness of staff, cleanliness of the hotel, availability of amenities, variety of food options, and value for money."", ""\n  Attributes: Comfort, ambience, atmosphere.\n\nThe review mentions the 'wonderful stay experience' provided by the hotel, suggesting that the environment of the hotel is comfortable and pleasant. This could be attributed to the ambience and atmosphere of the hotel, which is likely to be relaxing and inviting.""]",5,positive,"defaultdict(<class 'list'>, {('hotel', 'service', 'others'): ['ice', 'party', 'club', 'lounge'], ('hotel', 'service', 'facility'): ['club lounge friendly', 'club lounge'], ('hotel', 'price', 'others'): ['min'], ('hotel', 'environment', 'resort'): ['wonderful stay experience'], ('hotel', 'service', 'breakfast'): ['tea', 'staf', 'eating', 'eatin', 'eat']})","Counter({('hotel', 'service', 'breakfast'): 5, ('hotel', 'service', 'others'): 4, ('hotel', 'service', 'facility'): 2, ('hotel', 'price', 'others'): 1, ('hotel', 'environment', 'resort'): 1})","[{'path': ('hotel', 'service'), 'count': 11, 'keywords': ['ice', 'club', 'staf', 'club lounge friendly', 'tea', 'eatin', 'club lounge', 'eat', 'lounge', 'party', 'eating']}, {'path': ('hotel', 'price'), 'count': 1, 'keywords': ['min']}, {'path': ('hotel', 'environment'), 'count': 1, 'keywords': ['wonderful stay experience']}]","[(""hotel, service""):""1"", (""hotel, price""):""0"", (""hotel, environment""):""1""]",[],,,,2,
115170,5,hotel,this was an excellent hostel to stay in for a few days in mirador mansion the receptionists were friendly and welcoming i felt safe and secure here and my room and bathroom was very clean upon check in also hostel was walking distance to the tsim sha tsui promenade laser light show subway stations shopping and restaurants ,"['price', 'environment', 'service']","['bathroo', 'dist', 'min', 'excellent hostel', 'rest', 'promenade', 'las', 'restaurant', 'also hostel', 'hostel', 'restaurants', 'room', 'bath', 'sts', 'restauran', 'bathroom', 'lean', 'day', 'subway']",0,0,0,0,1,1,1,0,0,0,0,0,0,hotel|price,"[""\n\nThe review mentions the excellent hostel service, which is likely to have contributed to the positive sentiment. The review also mentions the hostel's proximity to the Tsim Sha Tsui Promenade, laser light show, subway stations, shopping, and restaurants, which could have been a factor in the positive sentiment. Additionally, the review mentions the cleanliness of the room and bathroom, which could have been a contributing factor to the sentiment. \n\n- Analyzing '('reception"", '\n\nThe review mentions the price of the hotel, which could have been a factor in the positive sentiment. The review mentions that the price was ""min"", which could have been seen as a good value for money.', '\n\nThe review mentions the environment of the hotel, which could have been a factor in the positive sentiment. The review mentions the cleanliness of the bathroom, which could have been seen as a sign of a pleasant environment.']",5,positive,"defaultdict(<class 'list'>, {('hotel', 'service', 'facility'): ['promenade', 'hostel', 'excellent hostel', 'las', 'also hostel', 'sts'], ('hotel', 'service', 'others'): ['restaurant', 'restaurants', 'restauran', 'dist', 'rest'], ('hotel', 'service', 'breakfast'): ['bathroom', 'room', 'subway', 'lean', 'day'], ('hotel', 'price', 'others'): ['min'], ('hotel', 'service', 'cleaniness'): ['bath'], ('hotel', 'environment', 'resort'): ['bathroo']})","Counter({('hotel', 'service', 'facility'): 6, ('hotel', 'service', 'others'): 5, ('hotel', 'service', 'breakfast'): 5, ('hotel', 'price', 'others'): 1, ('hotel', 'service', 'cleaniness'): 1, ('hotel', 'environment', 'resort'): 1})","[{'path': ('hotel', 'service'), 'count': 17, 'keywords': ['excellent hostel', 'hostel', 'sts', 'room', 'lean', 'also hostel', 'bath', 'promenade', 'restaurants', 'restauran', 'restaurant', 'las', 'bathroom', 'day', 'dist', 'rest', 'subway']}, {'path': ('hotel', 'price'), 'count': 1, 'keywords': ['min']}, {'path': ('hotel', 'environment'), 'count': 1, 'keywords': ['bathroo']}]","[(""hotel, service""):""1"", (""hotel, price""):""0"", (""hotel, environment""):""1""]",[],,,,2,
114598,5,hotel,all staff are friendly and helpful good location and i will be back if i am in hong kong in future i was given a free upgrade to deluxe room free of charge did not try the breakfast so cannot comment on it stay here and you will not regret ,"['price', 'environment', 'service']","['cann', 'room', 'reg', 'staf', 'given', 'location', 'breakfast']",0,0,0,0,1,1,1,0,0,0,0,0,0,hotel|price,"[""\n  Attributes: Friendly staff, helpful staff, free upgrade to deluxe room, good location\n\nThe review mentions the hotel's service multiple times, indicating that the staff were friendly and helpful, and that the reviewer was given a free upgrade to a deluxe room. The reviewer also mentions the good location of the hotel, which could have contributed to the positive sentiment. \n\n- Analyzing '('hotel', 'experience')' (mentioned 4 times): \n  Key"", '\n  Attributes: No mention of price\n\nThe review does not mention the price of the hotel, indicating that the reviewer was satisfied with the value for money. This could have contributed to the positive sentiment expressed in the review.']",5,positive,"defaultdict(<class 'list'>, {('hotel', 'service', 'others'): ['given', 'location', 'reg'], ('hotel', 'service', 'breakfast'): ['room', 'breakfast', 'staf'], ('hotel', 'price', 'others'): ['cann']})","Counter({('hotel', 'service', 'others'): 3, ('hotel', 'service', 'breakfast'): 3, ('hotel', 'price', 'others'): 1})","[{'path': ('hotel', 'service'), 'count': 6, 'keywords': ['room', 'reg', 'staf', 'breakfast', 'given', 'location']}, {'path': ('hotel', 'price'), 'count': 1, 'keywords': ['cann']}]","[(""hotel, service""):""1"", (""hotel, price""):""1""]","[('hotel, environment': '1')]",,,,3,
132856,3,hotel,as per the title rosedale kowloon is a new hotel that was only set up in 2012 hence you can expect new and clean furnishing in the hotel while checking in you will come across a well maintained furnished reception perhaps its new hence they have a set of weird housekeeping rules and regulations that guests must follow while resting at the reception level i was resting there while waiting to leave for the airport and was about to eatmy take away herbal jelly fyi its a really small tupperware but just as i was about to eat i was stopped by the staff apparently its no eating and drinking at the lobby just thinking aloud if cleanliness is their top priority and that guests cant even nibble there why bother to place a coffee table and sofa then why not just barricade ,"['price', 'environment', 'service']","['reg', 'furnished', 'eat', 'lean', 'rent', 'ale', 'rest', 'house', 'drinking', 'low', 'war', 'housekeeping', 'lat', 'rica', 'housekeepin', 'housekeep', 'coffee', 'eating', 'drink', 'hotel w', 'hotel', 'fee', 'eatmy', 'resting', 'level', 'w hotel', 'staf', 'sts', 'eatin', 'hen', 'mall', 'place', 'por', 'atm', 'rio', 'guest', 'guests', 'new hotel']",0,0,0,0,1,1,1,0,0,0,0,0,0,hotel|price,"[""\n\nThe review mentions the hotel's service multiple times, which is likely to have a negative impact on the sentiment. The keywords associated with this aspect suggest that the hotel has strict housekeeping rules and regulations, which may be seen as inconvenient for guests. Additionally, the review mentions that the hotel has a coffee table and sofa, but does not allow guests to eat or drink in the lobby, which could be seen as contradictory and inconvenient. This could be seen as a sign of poor service, which"", ""\n\nThe review mentions the hotel's price twice, which could be seen as a negative factor. The keywords associated with this aspect suggest that the hotel is relatively low-priced, which could be seen as a sign of poor quality. Additionally, the review mentions an ATM, which could be seen as a sign of the hotel's lack of amenities, which could be seen as a sign of poor service."", ""\n\nThe review mentions the hotel's environment four times, which could be seen as a negative factor. The keywords associated with this aspect suggest that the hotel is located in a relatively low-rent area, which could be seen as a sign of poor quality. Additionally, the review mentions the hotel's location in Rio de Janeiro, which could be seen as a sign of the hotel's lack of amenities, which could be seen as a sign of poor service.""]",3,negative,"defaultdict(<class 'list'>, {('hotel', 'service', 'breakfast'): ['house', 'drinking', 'housekeep', 'guests', 'coffee', 'eat', 'lean', 'ale', 'housekeepin', 'eating', 'drink', 'eatmy', 'resting', 'staf', 'eatin'], ('hotel', 'service', 'others'): ['place', 'level', 'housekeeping', 'hotel', 'war', 'fee', 'reg', 'hen', 'rest'], ('hotel', 'price', 'others'): ['low', 'atm'], ('hotel', 'environment', 'resort'): ['rent', 'rica', 'por', 'rio'], ('hotel', 'service', 'facility'): ['lat', 'hotel w', 'w hotel', 'mall', 'new hotel', 'sts', 'furnished'], ('hotel', 'service', 'staff'): ['guest']})","Counter({('hotel', 'service', 'breakfast'): 15, ('hotel', 'service', 'others'): 9, ('hotel', 'service', 'facility'): 7, ('hotel', 'environment', 'resort'): 4, ('hotel', 'price', 'others'): 2, ('hotel', 'service', 'staff'): 1})","[{'path': ('hotel', 'service'), 'count': 32, 'keywords': ['guest', 'housekeep', 'drinking', 'eatin', 'hen', 'place', 'eat', 'coffee', 'rest', 'house', 'lean', 'housekeeping', 'reg', 'resting', 'hotel w', 'w hotel', 'drink', 'ale', 'lat', 'furnished', 'guests', 'eatmy', 'hotel', 'mall', 'war', 'eating', 'sts', 'new hotel', 'staf', 'level', 'housekeepin', 'fee']}, {'path': ('hotel', 'price'), 'count': 2, 'keywords': ['low', 'atm']}, {'path': ('hotel', 'environment'), 'count': 4, 'keywords': ['rio', 'rent', 'por', 'rica']}]","[(""hotel, service""):""1"", (""hotel, price""):""0"", (""hotel, environment""):""1""]",[],,,,2,
126916,5,hotel,this is the second time i m staying in this hotel and still love it location of the hotel is really convenient the room is spacious and very cozy room brightness and desk space makes great working space as well very comfortable stay and excellent service ,"['price', 'environment', 'service']","['room', 'fort', 'hotel', 'location', 'ice', 'eat', 'spa', 'cozy']",0,0,0,0,1,1,1,0,0,0,0,0,0,hotel|price,"[""\n  Attributes: Cleanliness, Comfort, Amenities, Location, Service\n\nThe review mentions the hotel's service 8 times, indicating that the service provided was satisfactory. The keywords 'ice', 'cozy', 'room', 'spa', 'hotel', 'eat', 'fort', and 'location' suggest that the hotel provided a comfortable and clean environment, with amenities such as a spa and restaurant. The review also mentions the hotel's convenient location, which could have contributed to""]",5,positive,"defaultdict(<class 'list'>, {('hotel', 'service', 'breakfast'): ['cozy', 'room', 'eat'], ('hotel', 'service', 'facility'): ['fort'], ('hotel', 'service', 'others'): ['location', 'ice', 'spa', 'hotel']})","Counter({('hotel', 'service', 'others'): 4, ('hotel', 'service', 'breakfast'): 3, ('hotel', 'service', 'facility'): 1})","[{'path': ('hotel', 'service'), 'count': 8, 'keywords': ['ice', 'cozy', 'room', 'spa', 'hotel', 'eat', 'fort', 'location']}]","[(""hotel, service""):""1""]","[('hotel, price': '1'), ('hotel, environment': '0')]",,,,2,
