Unnamed: 0,rating,industry,content,masked_subcat,masked_keyword,catering|environment,catering|price,catering|cusine,catering|service,hotel|environment,hotel|price,hotel|service,attraction|environment,attraction|price,attraction|transportation,banking_finance_insurance|product,banking_finance_insurance|service,banking_finance_insurance|price,industry_granular,explaination,sentiment_score,sentiment_label,path_keywords_dict,path_counts,path_list,true_label_array,false_label_array,Got Correct,Accuracy,is_marked,Unnamed: 28,Unnamed: 29
188022,5,attraction,will definitely recommend a day trip to lantau island if you have more than 3 days in hong kong the 1 day trip was a refreshing change in scenery from hong kong island with its mountain view and cooler weather my parents even think that the island is the highlight of our hong kong trip as it s naturally calmer there lots to explore for the spiritual and common tourists alike besides you can always stop by at the citygate outlet mall before after the ngong ping 360 ride to lantau island for some discount outlets shopping tip we had our peak tram passes with us and hence were entitled for a 10 discount on the ngong ping 360 we were fine in the standard cabin although kids may appreciate the crystal cabin more alternatively if your trip to victoria peak is scheduled for later you may keep your ngong ping 360 tickets for a 10 for your peak tram ride then again the queue for tickets was really long and i would recommend to get the tickets online instead if it reduces queuing time despite so the trip was worth it but be sure to get an early start ,"['price', 'environment', 'transportation']","['worth', 'explore', 'men', 'ride', 'standard cabin', 'art', 'light', 'gain', 'tickets', 'ticket', 'tourist', 'trip', 'pass', 'ids', 'tram ride', 'scenery', 'sts', 'discount', 'standard', 'cabin']",0,0,0,0,0,0,0,1,1,1,0,0,0,attraction|price,"[""\n  Attributes: scenic views, cooler weather, calmer atmosphere\nThe review mentions the scenic views and cooler weather of Lantau Island, which contribute to the overall positive sentiment. The calmer atmosphere of the island is also highlighted, which is likely to be appreciated by visitors looking for a break from the hustle and bustle of Hong Kong Island. \n\n- Analyzing '('attraction', 'activities')' (mentioned 2 times): \n  Keywords: ['"", '\n  Attributes: peak tram passes, ngong ping 360 ride, crystal cabin, discount outlets, online tickets\nThe review mentions the availability of peak tram passes and the ngong ping 360 ride, which are likely to be attractive to tourists looking for a convenient and cost-effective way to explore the island. The review also mentions the availability of the crystal cabin, which is likely to be appreciated by children. Furthermore, the review mentions the availability of discount outlets and online tickets, which are likely to', '\n  Attributes: peak tram passes, 10 discount, online tickets\nThe review mentions the availability of peak tram passes, which are likely to be attractive to tourists looking for a convenient and cost-effective way to explore the island. The review also mentions the 10 discount available for the ngong ping 360 ride, which is likely to be appreciated by tourists looking to save money. Furthermore, the review mentions the availability of online tickets, which are likely to be attractive to tourists looking to avoid long queues.']",5,positive,"defaultdict(<class 'list'>, {('attraction', 'environment', 'attraction'): ['art', 'men', 'gain'], ('attraction', 'transportation', 'others'): ['scenery', 'tourist', 'sts', 'explore', 'cabin', 'ticket', 'ride', 'trip', 'tram ride'], ('attraction', 'transportation', 'flight'): ['light', 'tickets'], ('attraction', 'price', 'others'): ['standard', 'worth', 'pass', 'discount', 'ids'], ('attraction', 'transportation', 'shuttle bus'): ['standard cabin']})","Counter({('attraction', 'transportation', 'others'): 9, ('attraction', 'price', 'others'): 5, ('attraction', 'environment', 'attraction'): 3, ('attraction', 'transportation', 'flight'): 2, ('attraction', 'transportation', 'shuttle bus'): 1})","[{'path': ('attraction', 'environment'), 'count': 3, 'keywords': ['art', 'men', 'gain']}, {'path': ('attraction', 'transportation'), 'count': 12, 'keywords': ['tourist', 'tram ride', 'sts', 'standard cabin', 'ride', 'cabin', 'explore', 'ticket', 'trip', 'scenery', 'tickets', 'light']}, {'path': ('attraction', 'price'), 'count': 5, 'keywords': ['pass', 'worth', 'ids', 'discount', 'standard']}]","[(""attraction, environment""):"""", (""attraction, transportation""):"""", (""attraction, price""):""""]",[],,,,,
157003,5,attraction,this temple is buried in the middle of the city and is a nice quiet change of pace i felt welcome by the worshippers and pretty comfortable there are a few photos up around the temple asking people to not take tourists however i just asked the guys working at the temple and they said as long as i don t take photos of worshippers and don t intrude i can take a few but i would be respectful and ask first this temple has beautiful spiral incense burners hanging everywhere it was my favourite thing about this temple living in china these temples are everywhere but the spirals were different for me ,"['price', 'environment', 'transportation']","['spec', 'sts', 'tourist', 'guys', 'favour']",0,0,0,0,0,0,0,1,1,1,0,0,0,attraction|price,"[""\n  Attributes: The environment of the temple was welcoming and comfortable, with the worshippers being friendly and accommodating. The presence of photos asking people to not take photos of worshippers was also noted, indicating that the temple is respectful of its visitors. \n\n- Analyzing '('attraction', 'aesthetics')' (mentioned 1 times): \n  Keywords: ['spiral', 'incense', 'burners', 'hanging']\n  Attributes: The temple"", '\n  Attributes: The temple was free to visit, making it an attractive option for tourists.', '\n  Attributes: The temple is conveniently located in the middle of the city, making it easily accessible for tourists.']",5,positive,"defaultdict(<class 'list'>, {('attraction', 'environment', 'attraction'): ['guys'], ('attraction', 'price', 'discount'): ['favour'], ('attraction', 'transportation', 'others'): ['tourist', 'sts'], ('attraction', 'price', 'others'): ['spec']})","Counter({('attraction', 'transportation', 'others'): 2, ('attraction', 'environment', 'attraction'): 1, ('attraction', 'price', 'discount'): 1, ('attraction', 'price', 'others'): 1})","[{'path': ('attraction', 'environment'), 'count': 1, 'keywords': ['guys']}, {'path': ('attraction', 'price'), 'count': 2, 'keywords': ['favour', 'spec']}, {'path': ('attraction', 'transportation'), 'count': 2, 'keywords': ['tourist', 'sts']}]","[(""attraction, environment""):"""", (""attraction, price""):"""", (""attraction, transportation""):""""]",[],,,,,
156190,5,attraction,we enjoyed the tour from the beginning to the end michael is a great guy always willing to answer all your questions you get deep in knowing hong kong history and places he has a very good background in town and knows just the right spots and routes to get into hk we had a great time going through 6 different transport systems some of them historical ,"['price', 'environment', 'transportation']","['willing', 'answer', 'transport', 'transport system', 'transport systems']",0,0,0,0,0,0,0,1,1,1,0,0,0,attraction|price,"[""\n  Attributes: The tour was reasonably priced and the guide was willing to answer all questions. This indicates that the customer felt that they were getting value for their money, which likely contributed to the positive sentiment.\n\n- Analyzing '('attraction', 'knowledge')' (mentioned 2 times): \n  Keywords: ['background', 'right']\n  Attributes: The guide had a good background in the city and knew the right spots and routes to take. This suggests that the"", '\n  Attributes: The tour included 6 different transport systems, some of which were historical. This indicates that the customer was able to experience a variety of transportation options, which likely contributed to the positive sentiment.']",5,positive,"defaultdict(<class 'list'>, {('attraction', 'price', 'package'): ['answer'], ('attraction', 'price', 'others'): ['willing'], ('attraction', 'transportation', 'others'): ['transport', 'transport system', 'transport systems']})","Counter({('attraction', 'transportation', 'others'): 3, ('attraction', 'price', 'package'): 1, ('attraction', 'price', 'others'): 1})","[{'path': ('attraction', 'price'), 'count': 2, 'keywords': ['answer', 'willing']}, {'path': ('attraction', 'transportation'), 'count': 3, 'keywords': ['transport system', 'transport systems', 'transport']}]","[(""attraction, price""):"""", (""attraction, transportation""):""""]","[('attraction, environment': '')]",,,,,
179103,3,attraction,the famous harbour of hongkong you can ride the ferry on it or enjoy the walk or view by it the skyline is nice during the day or evening,"['price', 'transportation']","['ferry', 'ride']",0,0,0,0,0,0,0,0,1,1,0,0,0,attraction|price,"[""\n  Attributes: The harbour of Hong Kong provides a convenient and accessible form of transportation, allowing visitors to take a ferry ride and enjoy the view of the skyline.\n\n- Analyzing '('view', 'skyline')' (mentioned 2 times): \n  Keywords: ['view', 'skyline']\n  Attributes: The skyline of Hong Kong is beautiful and captivating, providing a stunning view during the day or evening.\n\n- Analyzing '('enjoyment""]",3,negative,"defaultdict(<class 'list'>, {('attraction', 'transportation', 'others'): ['ferry', 'ride']})","Counter({('attraction', 'transportation', 'others'): 2})","[{'path': ('attraction', 'transportation'), 'count': 2, 'keywords': ['ride', 'ferry']}]","[(""attraction, transportation""):""""]","[('attraction, environment': ''), ('attraction, price': '')]",,,,,
167118,5,attraction,rang earlier in the day to check that it is open a lovely lady picked up the phone and gave me detailed instructions on how to get there when we arrived we were warmly invited for tea tasting we tried a variety of tea and they were just gorgeous thank you ,"['price', 'environment']","['gave', 'tasting', 'open', 'variety', 'love', 'invited', 'invite']",0,0,0,0,0,0,0,1,1,0,0,0,0,attraction|price,"[""\n  Attributes: The environment of the tea tasting was inviting and warm, which created a positive atmosphere for the customer.\n\n- Analyzing '('service', 'staff')' (mentioned 1 times): \n  Keywords: ['rang', 'picked', 'invited']\n  Attributes: The staff was friendly and helpful, providing detailed instructions on how to get to the tea tasting and warmly inviting the customer.\n\n- Analyzing '('tea', 'tasting"", '\n  Attributes: The tea tasting was open and inviting, with a variety of teas to choose from. The staff was friendly and gave detailed instructions on how to get there. The customer was warmly invited and felt welcomed.']",5,positive,"defaultdict(<class 'list'>, {('attraction', 'environment', 'attraction'): ['tasting'], ('attraction', 'price', 'others'): ['love', 'open', 'invited', 'invite'], ('attraction', 'price', 'package'): ['variety'], ('attraction', 'price', 'special offer'): ['gave']})","Counter({('attraction', 'price', 'others'): 4, ('attraction', 'environment', 'attraction'): 1, ('attraction', 'price', 'package'): 1, ('attraction', 'price', 'special offer'): 1})","[{'path': ('attraction', 'environment'), 'count': 1, 'keywords': ['tasting']}, {'path': ('attraction', 'price'), 'count': 6, 'keywords': ['invite', 'open', 'gave', 'variety', 'invited', 'love']}]","[(""attraction, environment""):"""", (""attraction, price""):""""]","[('attraction, transportation': '')]",,,,,
176187,5,attraction,what a wonderful guide stanley is thanks to him we spent three amazing days exploring yangshuo county off the beaten tracks walking through the tangerine and rice fields passing villages along the river stanley made sure that we learn history of the place and have lots of fun along the way he is highly trustable knowledgeable and has very well sense of how people are how to meet their specific needs highly recommend taking tour with him ,"['price', 'environment']","['pass', 'spec', 'trustable', 'specific', 'exploring', 'men', 'trust']",0,0,0,0,0,0,0,1,1,0,0,0,0,attraction|price,"[""\n  Attributes: Stanley's knowledge and trustworthiness, his ability to meet the needs of the group, and his enthusiasm for the area.\n\n- Analyzing '('attraction', 'environment')' (mentioned 1 times): \n  Keywords: ['tangerine', 'rice fields', 'villages', 'river']\n  Attributes: The natural beauty of the area, the variety of landscapes, and the historical significance of the area.\n\n- Analyzing '('"", ""\n  Attributes: Stanley's trustworthiness and his ability to create a safe and enjoyable environment for the group.\n\n- Analyzing '('attraction', 'experience')' (mentioned 1 times): \n  Keywords: ['fun']\n  Attributes: Stanley's enthusiasm and his ability to create a fun and memorable experience for the group."", ""\n  Attributes: Stanley's ability to provide a tour that meets the specific needs of the group at an affordable price.""]",5,positive,"defaultdict(<class 'list'>, {('attraction', 'transportation', 'others'): ['exploring'], ('attraction', 'environment', 'attraction'): ['trustable', 'men', 'trust'], ('attraction', 'price', 'others'): ['pass', 'spec'], ('attraction', 'price', 'special offer'): ['specific']})","Counter({('attraction', 'environment', 'attraction'): 3, ('attraction', 'price', 'others'): 2, ('attraction', 'transportation', 'others'): 1, ('attraction', 'price', 'special offer'): 1})","[{'path': ('attraction', 'transportation'), 'count': 1, 'keywords': ['exploring']}, {'path': ('attraction', 'environment'), 'count': 3, 'keywords': ['men', 'trust', 'trustable']}, {'path': ('attraction', 'price'), 'count': 3, 'keywords': ['pass', 'specific', 'spec']}]","[(""attraction, transportation""):"""", (""attraction, environment""):"""", (""attraction, price""):""""]",[],,,,,
176750,5,attraction,i m from spore and came here to attend concert the sound system and stage mechanism is very good seats wise also unblock as the height of the rows is alright for photography i used exit d3 of hong hom mtr so i find this shortest walk back to mtr will come back for other concerts ,"['environment', 'transportation']","['seats', 'sound']",0,0,0,0,0,0,0,1,0,1,0,0,0,attraction|environment,"[""\n  Attributes: The sound system and stage mechanism were praised for being very good, which likely contributed to the overall positive sentiment.\n\n- Analyzing '('attraction', 'seating')' (mentioned 1 times): \n  Keywords: ['seats']\n  Attributes: The reviewer found the seating to be unblocked and the height of the rows to be suitable for photography, which likely contributed to the overall positive sentiment.\n\n- Analyzing '('attraction"", '\n  Attributes: The reviewer used exit D3 of Hong Hom MTR, which was the shortest walk back to the MTR station. This likely contributed to the overall positive sentiment.']",5,positive,"defaultdict(<class 'list'>, {('attraction', 'environment', 'others'): ['sound'], ('attraction', 'transportation', 'shuttle bus'): ['seats']})","Counter({('attraction', 'environment', 'others'): 1, ('attraction', 'transportation', 'shuttle bus'): 1})","[{'path': ('attraction', 'environment'), 'count': 1, 'keywords': ['sound']}, {'path': ('attraction', 'transportation'), 'count': 1, 'keywords': ['seats']}]","[(""attraction, environment""):"""", (""attraction, transportation""):""""]","[('attraction, price': '')]",,,,,
175754,5,attraction,big thank you to our guide anson for making the tour so enjoyable pace was good tone informal and we got to see and feel the real present day hk as well as travel back in time highly recommended ,"['price', 'environment', 'transportation']","['enjoyable', 'travel', 'men', 'sent', 'fee']",0,0,0,0,0,0,0,1,1,1,0,0,0,attraction|price,"[""\n  Attributes: The environment of the tour was enjoyable and the guide, Anson, was friendly and knowledgeable.\n\n- Analyzing '('pace', 'informal')' (mentioned 2 times): \n  Keywords: ['good', 'tone']\n  Attributes: The pace of the tour was good and the tone was informal, allowing the participants to get a real feel for present-day Hong Kong.\n\n- Analyzing '('travel', 'time')'"", '\n  Attributes: The tour fee was reasonable and the participants were able to travel back in time, making the experience even more enjoyable.\n\nOverall, the review expresses a positive sentiment due to the enjoyable environment, good pace, informal tone, reasonable fee, and the ability to travel back in time. The guide, Anson, was also friendly and knowledgeable, which further contributed to the positive sentiment.', '\n  Attributes: The tour provided convenient transportation, allowing the participants to explore the city with ease.']",5,positive,"defaultdict(<class 'list'>, {('attraction', 'environment', 'attraction'): ['enjoyable', 'men'], ('attraction', 'price', 'others'): ['fee'], ('attraction', 'price', 'special offer'): ['sent'], ('attraction', 'transportation', 'others'): ['travel']})","Counter({('attraction', 'environment', 'attraction'): 2, ('attraction', 'price', 'others'): 1, ('attraction', 'price', 'special offer'): 1, ('attraction', 'transportation', 'others'): 1})","[{'path': ('attraction', 'environment'), 'count': 2, 'keywords': ['enjoyable', 'men']}, {'path': ('attraction', 'price'), 'count': 2, 'keywords': ['fee', 'sent']}, {'path': ('attraction', 'transportation'), 'count': 1, 'keywords': ['travel']}]","[(""attraction, environment""):"""", (""attraction, price""):"""", (""attraction, transportation""):""""]",[],,,,,
193570,4,attraction,hong kong has one of the most extensive metro networks in asia it is convenient and affordable for travel to almost all the places in hk except for a few remote areas like deep water bay victoria peak or stanley prison ,"['price', 'transportation']","['ford', 'travel']",0,0,0,0,0,0,0,0,1,1,0,0,0,attraction|price,"[""\n  Attributes: Convenience, affordability\n\nThe review mentions the convenience and affordability of the metro network in Hong Kong, which is a major attraction for travelers. The keywords 'travel' and 'ford' indicate that the metro network is a great way to get around the city, making it an attractive option for tourists. The convenience and affordability of the metro network make it a great choice for travelers, contributing to the overall positive sentiment.\n\n- Analyzing '('attraction', '""]",4,positive,"defaultdict(<class 'list'>, {('attraction', 'transportation', 'others'): ['ford', 'travel']})","Counter({('attraction', 'transportation', 'others'): 2})","[{'path': ('attraction', 'transportation'), 'count': 2, 'keywords': ['ford', 'travel']}]","[(""attraction, transportation""):""""]","[('attraction, environment': ''), ('attraction, price': '')]",,,,,
168643,5,attraction,i have been getting my hair done with breno at the mandarin salon for the past 3 years and can hand on heart say he s the best colourist i ve experienced in more than 20 years of having my hair coloured his skill and attention to detail is second to none breno will not let you leave until your hair looks absolutely perfect even if it s past the salon closing time he is a true artist my blonde balayage on natural brunette base looks incredible for months on end i get compliments on my hair all the time as expected the ambience and service at the mandarin is also exceptional overall an wonderful experience time and time again breno i hope you never leave hong kong because i truly wouldn t know what to do without you ,"['price', 'environment']","['gain', 'art', 'compliment', 'experienc', 'get compliments', 'men', 'getting', 'lime', 'heart', 'experience', 'attention', 'compliments']",0,0,0,0,0,0,0,1,1,0,0,0,0,attraction|price,"[""\n  Attributes: The review mentions that the customer has been getting their hair done with Breno for the past 3 years, and that they have experienced more than 20 years of having their hair coloured. This suggests that the customer has a strong connection with Breno and the salon, and that they have gained a lot of satisfaction from the experience. Additionally, the customer mentions that they get compliments on their hair all the time, which further reinforces the positive sentiment.\n\n- Analyzing '('service"", '\n  Attributes: The review mentions that the customer is getting their hair done with Breno at the Mandarin Salon, which suggests that the customer is satisfied with the price of the services. Additionally, the customer mentions that the ambience and service at the Mandarin is also exceptional, which further reinforces the positive sentiment.']",5,positive,"defaultdict(<class 'list'>, {('attraction', 'environment', 'attraction'): ['art', 'compliment', 'heart', 'compliments', 'attention', 'gain', 'get compliments', 'men'], ('attraction', 'environment', 'others'): ['experience', 'experienc'], ('attraction', 'price', 'package'): ['getting'], ('attraction', 'price', 'others'): ['lime']})","Counter({('attraction', 'environment', 'attraction'): 8, ('attraction', 'environment', 'others'): 2, ('attraction', 'price', 'package'): 1, ('attraction', 'price', 'others'): 1})","[{'path': ('attraction', 'environment'), 'count': 10, 'keywords': ['heart', 'art', 'men', 'get compliments', 'attention', 'compliments', 'experienc', 'gain', 'experience', 'compliment']}, {'path': ('attraction', 'price'), 'count': 2, 'keywords': ['lime', 'getting']}]","[(""attraction, environment""):"""", (""attraction, price""):""""]","[('attraction, transportation': '')]",,,,,
167375,4,attraction,came here for cocktails the drinks menu is extensive late on a saturday night it was bustling and loud not a place for deep conversation but the atmosphere was energetic the decor is unique the ceiling is covered with hundreds of butterflies hanging from thin metal hooks and hanging bunches of bottles of fairy dust in the middle of the low tables are piles of iron fairies kinda looks like a mass grave of fairies around the perimeter are more comfortable private seating areas in the burners interesting decor ,"['price', 'environment', 'transportation']","['cock', 'bus', 'low', 'atm', 'men', 'interest', 'versa', 'energetic']",0,0,0,0,0,0,0,1,1,1,0,0,0,attraction|price,"[""\n  Attributes: The review mentions that the place was bustling and loud late on a Saturday night, indicating that it is a popular destination. The review also mentions that the drinks menu is extensive, suggesting that the bar offers a wide variety of drinks. This could be a factor that contributes to its popularity.\n\n- Analyzing '('atmosphere', 'ambiance')' (mentioned 2 times): \n  Keywords: ['bustling', 'loud']\n  Attributes"", ""\n  Attributes: The review mentions that the tables are low and that there are piles of iron fairies around the perimeter, suggesting that the bar is reasonably priced. The review also mentions that there are more comfortable private seating areas, indicating that the bar offers a range of options for different budgets. This could be a factor that contributes to its popularity.\n\n- Analyzing '('attraction', 'decor')' (mentioned 3 times): \n  Keywords: ['butterflies"", '\n  Attributes: The review mentions that the atmosphere was energetic, suggesting that the bar has a lively and vibrant atmosphere. The review also mentions that the decor is unique, indicating that the bar has a distinct and interesting aesthetic. This could be a factor that contributes to its popularity.']",4,positive,"defaultdict(<class 'list'>, {('attraction', 'transportation', 'flight'): ['cock'], ('attraction', 'price', 'others'): ['low', 'interest', 'atm'], ('attraction', 'transportation', 'others'): ['bus'], ('attraction', 'environment', 'attraction'): ['men', 'versa'], ('attraction', 'environment', 'others'): ['energetic']})","Counter({('attraction', 'price', 'others'): 3, ('attraction', 'environment', 'attraction'): 2, ('attraction', 'transportation', 'flight'): 1, ('attraction', 'transportation', 'others'): 1, ('attraction', 'environment', 'others'): 1})","[{'path': ('attraction', 'transportation'), 'count': 2, 'keywords': ['bus', 'cock']}, {'path': ('attraction', 'price'), 'count': 3, 'keywords': ['low', 'interest', 'atm']}, {'path': ('attraction', 'environment'), 'count': 3, 'keywords': ['versa', 'men', 'energetic']}]","[(""attraction, transportation""):"""", (""attraction, price""):"""", (""attraction, environment""):""""]",[],,,,,
